{
  "schema_version": "1.0.0",
  "provider": "agent_sdk_seat",
  "tiers": {
    "extraction": {
      "model": "claude-haiku-4-5",
      "effort": "low",
      "max_tokens": 4000,
      "temperature": 0
    },
    "synthesis": {
      "model": "claude-opus-5",
      "effort": "high",
      "max_tokens": 16000,
      "temperature": null
    },
    "narrative": {
      "model": "claude-opus-5",
      "effort": "high",
      "max_tokens": 8000,
      "temperature": null
    }
  },
  "pricing": {
    "claude-haiku-4-5": {
      "input": 1.0,
      "output": 5.0,
      "cache_read": 0.1,
      "cache_write": 1.25
    },
    "claude-opus-5": {
      "input": 5.0,
      "output": 25.0,
      "cache_read": 0.5,
      "cache_write": 6.25
    }
  }
}
